{
   "applicability" : [
      {
         "domain" : "agent-memory",
         "reason" : "A thin loader and three small pillars keep execution aligned without a full program",
         "status" : "applicable"
      },
      {
         "domain" : "architecture",
         "reason" : "Tenant storage, authentication, public ids, wire format, and trust boundaries are load-bearing",
         "status" : "applicable"
      },
      {
         "domain" : "build",
         "reason" : "Authenticated CRUD must be delivered as a real vertical slice",
         "status" : "applicable"
      },
      {
         "domain" : "code-quality",
         "reason" : "Deterministic tests and a six-hour handoff require a small enforced quality baseline",
         "status" : "applicable"
      },
      {
         "domain" : "database",
         "reason" : "Notes and identities must persist across restart with tenant constraints",
         "status" : "applicable"
      },
      {
         "domain" : "deploy",
         "reason" : "The evaluation runs as a local Node process and explicitly excludes cloud deployment",
         "status" : "excluded"
      },
      {
         "domain" : "launch",
         "reason" : "The evaluation ends at local verification and has no public activation",
         "status" : "excluded"
      },
      {
         "domain" : "llm",
         "reason" : "The API performs deterministic note CRUD and makes no model calls",
         "status" : "excluded"
      },
      {
         "domain" : "observe",
         "reason" : "Trigger: before the first non-evaluator user or uptime promise. Local logs and health ship now; backend, SLO, paging, and runbook infrastructure remain reversible without service commitments",
         "status" : "deferred"
      },
      {
         "domain" : "product",
         "reason" : "The six-hour gate needs an explicit user, outcome, cut policy, and negative scope",
         "status" : "applicable"
      },
      {
         "domain" : "repo",
         "reason" : "The evaluator needs a reproducible local repository and one verification command",
         "status" : "applicable"
      },
      {
         "domain" : "roadmap",
         "reason" : "The six-hour appetite requires dependency order and hard cut rules",
         "status" : "applicable"
      },
      {
         "domain" : "security",
         "reason" : "Bearer authentication and multi-tenant CRUD create an IDOR boundary",
         "status" : "applicable"
      },
      {
         "domain" : "seo",
         "reason" : "There is no crawlable page or public discovery surface",
         "status" : "excluded"
      },
      {
         "domain" : "stack",
         "reason" : "Offline runtime, Node.js 22, and the time cap eliminate service-backed choices",
         "status" : "applicable"
      },
      {
         "domain" : "style-genome",
         "reason" : "Greenfield naming and error conventions must be fixed before the first handler",
         "status" : "applicable"
      },
      {
         "domain" : "ui",
         "reason" : "The deliverable is an HTTP contract with no rendered pixels",
         "status" : "excluded"
      },
      {
         "domain" : "ux",
         "reason" : "The developer-facing contract needs predictable recovery-oriented errors",
         "status" : "applicable"
      }
   ],
   "archetype" : "api-service",
   "created" : "2026-07-23",
   "decisions" : [
      {
         "falsifier" : {
            "failure_boundary" : "a third organization is required or opening configured stores consumes more than 100 ms p95",
            "replan_action" : "return to planning and evaluate replacing fixed tenant files with a local authorization directory plus dynamic tenant registry or a shared PostgreSQL design with forced row-level security",
            "signal" : "organization count and store-open duration from startup validation"
         },
         "id" : "D1",
         "title" : "Use one relational database file per organization"
      },
      {
         "falsifier" : {
            "failure_boundary" : "the credential requirement changes to create, rotate, revoke, or recover a credential through the API",
            "replan_action" : "return to planning and redesign authentication around a bounded identity lifecycle before adding any credential endpoint",
            "signal" : "evaluator setup attempts and authentication failures from redacted security logs"
         },
         "id" : "D2",
         "title" : "Use opaque bearer tokens mapped to immutable seeded principals"
      },
      {
         "falsifier" : {
            "failure_boundary" : "a required operation cannot be expressed without breaking an existing `/v1` request or response",
            "replan_action" : "return to planning and redesign the breaking surface as `/v2` with an explicit compatibility and retirement path",
            "signal" : "contract change log and consumer fixture failures"
         },
         "id" : "D3",
         "title" : "Use REST JSON under `/v1` with UUID public ids"
      },
      {
         "falsifier" : {
            "failure_boundary" : "any mounted route is absent from `openapi.json` or any error escapes in another shape",
            "replan_action" : "return to planning and replace the drifting generator or handler so one contract generator and one root error handler remain",
            "signal" : "contract test diffs and responses not matching the Problem Details schema"
         },
         "id" : "D4",
         "title" : "Generate one OpenAPI contract from runtime schemas and emit one error envelope"
      },
      {
         "falsifier" : {
            "failure_boundary" : "package acquisition is forbidden, a second process writes the same files, or sustained demand exceeds 10 requests per second",
            "replan_action" : "return to planning and switch to the native runner-up for no-package setup or adopt a service database for multi-writer demand",
            "signal" : "`npm run verify`, store lock errors, and the measured organization and writer counts"
         },
         "id" : "D5",
         "title" : "Pin a small Node.js 22 stack with no runtime service"
      }
   ],
   "format" : "godplans/plan-json@1",
   "input_digest" : "sha256:108cd9f004f8eb0a427ecd6a51f2e06dd95032e63ff496d9f22aa26f7176f061",
   "metrics" : {
      "domains" : [
         {
            "active" : 2,
            "domain" : "agent-memory",
            "historical" : 2,
            "superseded" : 0,
            "supersession_rate" : 0
         },
         {
            "active" : 3,
            "domain" : "architecture",
            "historical" : 3,
            "superseded" : 0,
            "supersession_rate" : 0
         },
         {
            "active" : 6,
            "domain" : "build",
            "historical" : 6,
            "superseded" : 0,
            "supersession_rate" : 0
         },
         {
            "active" : 6,
            "domain" : "code-quality",
            "historical" : 6,
            "superseded" : 0,
            "supersession_rate" : 0
         },
         {
            "active" : 2,
            "domain" : "database",
            "historical" : 2,
            "superseded" : 0,
            "supersession_rate" : 0
         },
         {
            "active" : 7,
            "domain" : "product",
            "historical" : 7,
            "superseded" : 0,
            "supersession_rate" : 0
         },
         {
            "active" : 3,
            "domain" : "repo",
            "historical" : 3,
            "superseded" : 0,
            "supersession_rate" : 0
         },
         {
            "active" : 1,
            "domain" : "roadmap",
            "historical" : 1,
            "superseded" : 0,
            "supersession_rate" : 0
         },
         {
            "active" : 5,
            "domain" : "security",
            "historical" : 5,
            "superseded" : 0,
            "supersession_rate" : 0
         },
         {
            "active" : 1,
            "domain" : "stack",
            "historical" : 1,
            "superseded" : 0,
            "supersession_rate" : 0
         },
         {
            "active" : 1,
            "domain" : "style-genome",
            "historical" : 1,
            "superseded" : 0,
            "supersession_rate" : 0
         },
         {
            "active" : 1,
            "domain" : "ux",
            "historical" : 1,
            "superseded" : 0,
            "supersession_rate" : 0
         }
      ],
      "task_history" : {
         "active" : 7,
         "historical" : 7,
         "superseded" : 0,
         "supersession_rate" : 0,
         "survival_rate" : 1
      }
   },
   "mode" : "greenfield",
   "name" : "tenant-notes-api",
   "phases" : [
      {
         "name" : "Contract and isolated persistence",
         "number" : 1,
         "tasks" : [
            "GP-101",
            "GP-102",
            "GP-103"
         ]
      },
      {
         "name" : "Note CRUD and adversarial isolation",
         "number" : 2,
         "tasks" : [
            "GP-201",
            "GP-202",
            "GP-203"
         ]
      },
      {
         "name" : "Verification",
         "number" : 3,
         "tasks" : [
            "GP-301"
         ]
      }
   ],
   "plan_digest" : "sha256:a7a21f366124e70865204928efbaace90a3ede8e5e689f8ea33a9bf010c6982f",
   "plan_version" : 1,
   "product_form" : "api-or-service",
   "progress" : {
      "phases_done" : 0,
      "phases_total" : 3,
      "tasks_done" : 0,
      "tasks_total" : 7
   },
   "public_release" : false,
   "source_revision" : "none",
   "status" : "planning",
   "superseded_tasks" : [],
   "tasks" : [
      {